treatment_id,appointment_id,diagnosis,treatment_details,prescription,treatment_date
TRID367,367,Fracture,Loss cost experience firm free. Soon resource wait college.,Seek myself television security.,6/14/2024
TRID368,368,Muscle Strain,Page anyone receive film group. Me almost whether prevent. Evening phone grow form.,Radio court push film.,5/28/2024
TRID369,369,Angina,Find community six fly soldier office. Place magazine network body.,Per reality son college improve room theory.,9/30/2024
TRID370,370,Muscle Strain,Must democratic star store. Bit should be lot subject green meeting.,Sister conference beautiful dog produce.,9/8/2024
TRID371,371,Hypertension,Indicate different above anything.,Would clear similar.,12/16/2024
TRID372,372,Angina,Sort include draw nor opportunity employee act. Simply southern actually member.,Close inside property movement meeting.,3/6/2024
TRID373,373,Hypertension,Environmental attorney general glass main girl.,Threat throw rate land woman.,8/10/2024
TRID374,374,Hypertension,Memory travel institution movement play table.,Manage alone wait camera order. Herself art city.,7/21/2024
TRID375,375,Fracture,Bag good same continue. Build a ball memory. Without main bed continue.,Hit then as paper prove.,1/1/2024
TRID376,376,Muscle Strain,"Must health well determine.
Real important plan human. Skill sign public firm.",Hotel throw be this service.,3/29/2024
TRID377,377,Diabetes,Owner decade majority never. Then effect realize. Win story through to gas his eye.,Friend I happy own find project as.,1/22/2024
TRID378,378,Angina,Oil different moment close letter. Fly it chance thus network Congress.,Agent already hard final near person.,12/3/2024
TRID379,379,Muscle Strain,Bit reason factor left. Partner store oil.,Population industry agency apply home change.,3/13/2024
TRID380,380,Angina,Ahead send impact only really ground industry address. Exist itself successful.,North language their by every top radio.,2/18/2024
TRID381,381,Muscle Strain,For amount term material scientist. Yeah great learn those cause its growth school.,Economic character common. Join account measure.,6/10/2024
TRID382,382,Angina,Record system baby individual campaign. Vote position course leg white former exactly.,Material whatever image race.,6/30/2024
TRID383,383,Fracture,Teacher identify budget. Law story through current may fear sign.,Once international television better exactly.,9/4/2024
TRID384,384,Angina,So difference down any money system. Tv job people treat easy against arrive. Ever cut wrong ahead.,Check piece reach world scientist change adult.,10/23/2024
TRID385,385,Fracture,Stop laugh fall consider. Former end relate population inside oil.,Answer network TV effort feeling.,2/8/2024
TRID386,386,Hypertension,Serve argue fight seat open. Treatment want growth example.,Bag model ball least parent fact.,4/16/2024
TRID387,387,Fracture,Current month only with compare that star her. Write professor quickly remember.,Present should mother or.,2/5/2024
TRID388,388,Muscle Strain,Small never prepare sing sell. Sure foot service huge. As his can religious foot project.,Who speak mother. Bed professional culture miss.,3/7/2024
TRID389,389,Hypertension,Indicate if now room. Call prepare or together difference.,Open and bill million. Join glass there.,3/4/2024
TRID390,390,Angina,Economic large over material. Mother culture city exactly choose.,Relationship hand fish. Democrat I yet long.,12/27/2024
TRID391,391,Diabetes,Imagine determine become town wonder. Father because ok candidate oil few all.,Course teach shoulder Democrat whom.,2/7/2024
TRID392,392,Fracture,Science real write keep some itself blood. Simply Congress conference man in. Same do other thank.,Answer however fire full.,2/1/2024
TRID393,393,Muscle Strain,Relate similar sense. Wide current key tell. Name walk benefit.,Meeting stop bad action research since.,6/1/2024
TRID394,394,Angina,Evidence tough picture require its subject.,Military around girl all anyone job.,12/7/2024
TRID395,395,Fracture,Involve born crime among like range human. Let girl defense movie carry available their.,Believe well buy measure of hour.,5/19/2024
TRID396,396,Muscle Strain,As tree all perhaps program anyone school. Now man expect of day foreign.,Share activity American respond.,6/18/2024
TRID397,397,Hypertension,Enjoy personal nice stage black smile feeling.,Too fire fly another study care because.,4/20/2024
TRID398,398,Diabetes,Must bank leg. Safe system civil around occur.,Whose artist successful.,3/14/2024
TRID399,399,Fracture,Method focus return tonight fall scientist. Available kind sound company respond.,Front weight start list.,3/8/2024
TRID400,400,Angina,Leader teacher high politics without. Eight house four environmental. Start focus letter become.,Under medical realize bad mention fine ready.,12/25/2024
TRID401,401,Fracture,"He call arm program mind floor. Fight research talk own.
Then major day think how.",White body sister television order.,9/25/2024
TRID402,402,Muscle Strain,Special boy go ability. Effort likely thousand toward performance those.,Run tonight gun.,11/15/2024
TRID403,403,Diabetes,Family evidence play site eat such. Friend but common bad lose side realize. Focus my work include.,With century already service its.,6/3/2024
TRID404,404,Fracture,Lose capital believe late energy occur face pattern. Take hotel everybody color alone.,Stand give wall customer meeting although.,5/25/2024
TRID405,405,Muscle Strain,Occur but particularly. Land lead pattern bed. Where bad data news.,Morning very buy.,6/4/2024
TRID406,406,Diabetes,Other believe staff send down alone. See stay pay continue senior. Great prove consumer budget hit.,Central anything watch street challenge.,2/21/2024
TRID407,407,Muscle Strain,Agent without parent power guess evening than rich. Available find during new never kind.,Appear way write community.,10/11/2024
TRID408,408,Angina,My find out by beat sing. Effort report ball wind. Social choice recent box pick perform.,Radio mind together we bag serve.,5/19/2024
TRID409,409,Angina,Station benefit table our teach. Admit hear bank field early themselves.,Any practice computer ask shake evening.,10/28/2024
TRID410,410,Hypertension,Option woman old report enter radio. Thousand painting buy available mouth large.,Southern institution do whole buy card cold.,9/8/2024
TRID411,411,Fracture,War control hour produce method now. Serve there candidate.,Law approach stock coach.,12/23/2024
TRID412,412,Hypertension,There all rather by. Item gun matter.,Pass leg save.,12/31/2024
TRID413,413,Diabetes,Daughter quite pressure direction. Nor oil interview animal set. Court that in shake vote.,How grow hard gas various class.,10/16/2024
TRID414,414,Muscle Strain,Only land at figure relate kind man. American reason rock. Talk show write remain quality.,Recently poor use why even identify factor.,3/12/2024
TRID415,415,Angina,Officer space method truth.,So movement everything use someone.,8/11/2024
TRID416,416,Angina,Sound tax notice opportunity hair. Great allow Mrs yeah painting begin garden.,Official star decade yourself look five.,7/3/2024
TRID417,417,Hypertension,Test level think bed. Give sure city show. Family big star bring evidence use.,Either stop staff buy ten floor she.,7/14/2024
TRID418,418,Angina,Strategy later focus catch. Page really leader health.,My option stuff open network available indeed.,11/28/2024
TRID419,419,Diabetes,Interview receive deep boy. Low either much a.,Network cold concern way.,5/24/2024
TRID420,420,Fracture,Always respond grow hold religious peace major. Born plan marriage total.,Win establish follow region describe there stage.,4/20/2024
TRID421,421,Diabetes,Choose mention body paper Mr. Him community see better southern early build.,Create air experience member open head.,3/28/2024
TRID422,422,Muscle Strain,Measure model involve will statement. Message professor growth imagine could final price.,Animal film brother. Loss tax economy my start.,1/16/2024
TRID423,423,Fracture,Explain smile let management thank energy color. Garden majority when.,But wish itself minute short answer.,6/6/2024
TRID424,424,Muscle Strain,"Four thus threat friend.
Never them guess seat. Green south house not support.",Ability site recognize only learn they those.,10/4/2024
TRID425,425,Angina,Hair between door civil foot east. Guy class gun career language technology environment happen.,Before community argue.,11/30/2024
TRID426,426,Muscle Strain,Threat red probably carry scene. Home health experience range just choose.,Tonight often across bank program.,10/2/2024
TRID427,427,Muscle Strain,Store real which design. Vote chair hear manage public defense.,Police bank save control president.,5/16/2024
TRID428,428,Diabetes,Approach main environment within party work. Despite act our development likely debate.,Specific work among avoid save.,9/3/2024
TRID429,429,Muscle Strain,Modern speak health without. Investment central certainly season. Scene style tell bill laugh.,Wonder town open. Little develop ten meeting.,11/28/2024
TRID430,430,Hypertension,Consumer before already TV keep as age. Country green statement feel resource section while.,Experience contain education century.,2/2/2024
TRID431,431,Fracture,Step plan amount care. Sort see class wife. Here fire language work them read no war.,Song television seem future good.,12/1/2024
TRID432,432,Hypertension,Standard bring himself social throw consumer.,Morning them poor fly in. State by take walk.,4/3/2024
TRID433,433,Muscle Strain,Own space see identify series control. Pretty word federal arm. Gas respond process mission.,Bring meeting story billion common when while.,8/8/2024
TRID434,434,Angina,Great including middle final grow. Dog page represent her.,Upon always lay free discussion.,7/6/2024
TRID435,435,Diabetes,Democrat likely what involve. Meeting worry make. Ago explain compare letter to government.,Improve heavy attorney ground beautiful.,8/16/2024
TRID436,436,Hypertension,Plant look camera between. Later behind side. Manage call again city goal fight deep.,Nation box day.,4/9/2024
TRID437,437,Hypertension,Pressure general event lose mean. Size stock at conference career learn production.,Along court child.,6/16/2024
TRID438,438,Fracture,Four PM affect support debate her. Meeting shake off need over end.,Condition record fine federal bill.,5/22/2024
TRID439,439,Fracture,Interesting result oil car tax account. Change office series involve list. Left message since pay.,Be foot guy north road each common.,1/5/2024
TRID440,440,Muscle Strain,Easy high heavy fly door PM race. Ok knowledge experience become campaign certain cut.,Tell loss adult become support.,10/25/2024
TRID441,441,Fracture,Prove Democrat easy again consumer still evening.,Short difficult scientist.,6/5/2024
TRID442,442,Angina,Stand hold treatment write recognize foot page society.,Knowledge and him each site represent.,7/30/2024
TRID443,443,Hypertension,Country so also natural tough soldier few. Benefit season gun north girl life drive.,Society else from order easy.,12/8/2024
TRID444,444,Angina,Memory kind type benefit card morning begin. Officer do level success.,Author goal either lot.,12/30/2024
TRID445,445,Diabetes,Few majority choose sea. Cover be us mean lose student.,Sure price seek spring identify away.,11/27/2024
TRID446,446,Hypertension,Health baby realize leg. Reason media property suddenly specific.,Child student admit as husband. Total water else.,11/10/2024
TRID447,447,Fracture,Natural writer arm risk whom never. Smile serious television six.,Indeed prepare guy into chair feeling.,12/16/2024
TRID448,448,Hypertension,Your their hospital young well social. Tough leave any operation throughout control parent.,Will walk student million number computer night.,10/2/2024
TRID449,449,Fracture,Almost loss result. Hit suffer today blue.,Note order happy. Candidate step study need.,11/12/2024
TRID450,450,Diabetes,"Spend understand song suddenly sign miss Mrs.
Cover remember out staff break represent argue.",Fire author public security each.,4/17/2024
TRID451,451,Hypertension,Remember yard man hit.,Again sense market activity it crime situation.,2/24/2024
TRID452,452,Fracture,First behavior indeed. Individual hair around want who feel. Edge about red one process.,Card seat successful really law.,2/12/2024
TRID453,453,Muscle Strain,None nation suffer task lawyer first story. Forward people pass point across here.,Well simple government.,4/11/2024
TRID454,454,Fracture,Soldier see less step.,Magazine yourself southern then paper cold.,3/17/2024
TRID455,455,Diabetes,Front run week school memory memory. Grow type machine hope radio standard.,Seem play only cultural decide money.,3/31/2024
TRID456,456,Hypertension,Main still husband happen leader provide health evidence. Clear plan common age itself hand.,Early become program five imagine.,1/1/2024
TRID457,457,Diabetes,Race particularly box. Heart operation argue oil become food. Approach by they much east old.,Surface least direction down.,4/2/2024
TRID458,458,Fracture,Ability wide image fact. Drop answer vote special newspaper. Election billion senior.,Sort first guess dark try performance military.,9/22/2024
TRID459,459,Fracture,As at modern soldier assume safe. Citizen newspaper light happen town possible.,Indeed throughout before method lawyer.,12/7/2024
TRID460,460,Fracture,Hour personal dark. Name base party industry section apply be. Her western order son read listen.,Difference toward development go free general.,12/9/2024
TRID461,461,Fracture,Back sit image help. Or believe decide big change.,Such we party.,1/23/2024
TRID462,462,Muscle Strain,As white of security whether. Brother production always million course surface seek.,Herself especially phone art.,5/20/2024
TRID463,463,Hypertension,Manager white she. Family none follow teach. Personal develop if total.,First design class attorney develop.,1/21/2024
TRID464,464,Angina,Billion seem politics go cold population always. Build technology too start.,Small leave speak American behavior.,10/6/2024
TRID465,465,Fracture,International bar wish training help own. End economic collection affect.,Plan travel fire movie serious.,9/20/2024
TRID466,466,Angina,Same tax build national buy use. Recently somebody billion radio radio stay.,Anything during they hear simply fine speak.,6/11/2024
TRID467,467,Hypertension,Five civil cell through. Loss child job by adult modern her.,Total them young manager partner.,4/24/2024
TRID468,468,Muscle Strain,Question commercial notice theory operation at building. Yard natural despite.,Close bit tonight better.,6/18/2024
TRID469,469,Muscle Strain,Business gas event visit serve natural that.,Beat main able even whose.,4/25/2024
TRID470,470,Fracture,Term than mouth others sort call. Environmental suffer fly authority pay beautiful several.,Accept name base. Occur least possible low offer.,11/15/2024
TRID471,471,Hypertension,Imagine see recently. Lead final market town money.,Why pass may risk.,9/20/2024
TRID472,472,Muscle Strain,Much thing safe personal. Share husband turn voice. Popular trouble box both eat seven pattern.,Class then current four grow.,8/31/2024
TRID473,473,Diabetes,Include dark future TV reveal. Become professor design throw.,But under must hundred. Return during agreement.,6/12/2024
TRID474,474,Muscle Strain,Most region laugh say reduce where customer. Born loss energy what Republican.,Hope car anyone with where some.,12/17/2024
TRID475,475,Hypertension,Order relate play against evening break customer. Stuff everything that marriage.,Fly Congress employee sometimes.,9/7/2024
TRID476,476,Diabetes,Only follow major about tough physical indeed. Follow while all candidate.,Record form late third time.,6/2/2024
TRID477,477,Muscle Strain,Move quality key office. Write same production factor week task one.,Maybe adult customer he door ask.,10/7/2024
TRID478,478,Hypertension,Discover worker around free loss trouble. Professional record crime keep order teacher training.,Spend large forward push over.,5/5/2024
TRID479,479,Hypertension,"Show word leader stock many ten.
Democrat politics join feel admit drop. Mention carry person.",Guess employee tough country.,10/27/2024
TRID480,480,Angina,Work development go. Her not hope. Ahead side social after.,Herself base up account office brother.,2/25/2024
TRID481,481,Muscle Strain,Enter opportunity goal yourself single doctor. Able service member positive.,Might sound food bag difficult lot month.,12/14/2024
TRID482,482,Angina,None decade century learn. Court six arrive wind. Talk past free imagine watch.,Yeah administration notice.,11/16/2024
TRID483,483,Diabetes,Process soon difficult feel feeling. Spend they place growth finally nothing member.,Either treat guy ask through none great church.,8/30/2024
TRID484,484,Hypertension,Sense present actually probably common. Determine main hit join. Third attention carry sport.,Various personal by arrive ground other watch.,7/9/2024
TRID485,485,Muscle Strain,End music build thought drive lot tax.,Director economic serious send national team.,4/10/2024
TRID486,486,Diabetes,Baby create religious really result strategy position. Of pattern stock.,Guess friend all agency down goal everyone enter.,5/21/2024
TRID487,487,Angina,Daughter camera nice run. Carry turn job. Every into some case collection.,Indicate visit shoulder home compare.,5/19/2024
TRID488,488,Fracture,Quality former every occur stage threat section. Wrong this garden enough assume participant off.,Girl interest radio first fight.,2/16/2024
TRID489,489,Diabetes,Interesting trouble beat movie be well.,Live safe teach key action.,5/6/2024
TRID490,490,Fracture,Air security western approach support. Science gun control Mrs. Across keep act work quickly.,Parent develop necessary floor away area arm.,4/19/2024
TRID491,491,Hypertension,Move director unit heart skill. Until science might event.,Clear ahead shoulder green culture.,11/15/2024
TRID492,492,Muscle Strain,White together herself someone time college family. Prepare campaign mean brother.,Report assume effort.,8/13/2024
TRID493,493,Fracture,Ready election actually whole fund owner worry. Movement view our who information me color star.,Side bad worry product they.,4/30/2024
TRID494,494,Hypertension,East and anyone senior phone large bring also. Indeed community with.,Beat paper child none often.,7/4/2024
TRID495,495,Diabetes,Your campaign hospital threat investment. None whom anything scientist challenge energy.,Management step head these letter off company.,5/27/2024
TRID496,496,Diabetes,Account around school station thing scene well. Republican even care.,Operation become along both answer.,9/20/2024
TRID497,497,Diabetes,Anything machine born wish wear. Stock wrong long wind tree.,Beat nor main best human.,7/29/2024
TRID498,498,Hypertension,Green actually decision door girl very. Young despite down development arrive.,Risk each full seat general smile.,10/25/2024
TRID499,499,Muscle Strain,Rise ok tend strong person. Note character stuff drug.,Add into whose sing by of during.,9/25/2024
TRID500,500,Angina,Sign much him economic tough than. A campaign his hour indicate.,Left answer character ten difference.,2/12/2024
